{
  "$schema": "https://hyperframes.local/schemas/motion-map.schema.json",
  "schemaVersion": "1.0.0",
  "revision": 1,
  "motionRevision": "motion-1",
  "status": "draft",
  "designRevision": "design-1",
  "assetRevision": "assets-1",
  "seed": "replace-with-project-seed",
  "owners": [],
  "integrity": { "digest": null, "upstream": {} }
}
